{
  "profile": "ASIEP",
  "profile_version": "0.1.0",
  "evaluation_id": "evaluation:asiep-v0.1-m6",
  "evaluation_version": "0.1.0",
  "created_at": "2026-05-05T07:00:00Z",
  "repository": {
    "name": "agent-accountability-evidence-layer",
    "root": ".",
    "commit": "local-reproducible-run"
  },
  "evaluated_components": [
    {
      "component_id": "profile_manifest",
      "path": "profiles/asiep/v0.1/profile.json",
      "status": "present"
    },
    {
      "component_id": "schema",
      "path": "schemas/asiep.schema.json",
      "status": "present"
    },
    {
      "component_id": "jsonld_context",
      "path": "contexts/asiep.context.jsonld",
      "status": "present"
    },
    {
      "component_id": "conformance_matrix",
      "path": "conformance/asiep_v0.1_matrix.yaml",
      "status": "present"
    },
    {
      "component_id": "validator",
      "path": "src/asiep_validator/validator.py",
      "status": "present"
    },
    {
      "component_id": "repairer",
      "path": "src/asiep_repairer/repairer.py",
      "status": "present"
    },
    {
      "component_id": "resolver",
      "path": "src/asiep_resolver/resolver.py",
      "status": "present"
    },
    {
      "component_id": "importer",
      "path": "src/asiep_importer/importer.py",
      "status": "present"
    },
    {
      "component_id": "packager",
      "path": "src/asiep_packager/packager.py",
      "status": "present"
    },
    {
      "component_id": "examples",
      "path": "examples",
      "status": "present"
    },
    {
      "component_id": "attack_corpus",
      "path": "attack_corpus",
      "status": "present"
    },
    {
      "component_id": "generated_packages",
      "path": "examples/generated_packages",
      "status": "present"
    }
  ],
  "corpus_summary": {
    "total_expected_results": 21,
    "valid_targets": 10,
    "invalid_targets": 11,
    "target_types": {
      "bundle": 4,
      "evidence_example": 6,
      "generated_package": 2,
      "import_request": 4,
      "package_request": 3,
      "repair_case": 2
    }
  },
  "pipeline_results": [
    {
      "target_path": "examples/valid_chatbot_improvement.json",
      "target_type": "evidence_example",
      "command": "PYTHONPATH=src python -m asiep_validator examples/valid_chatbot_improvement.json --format json",
      "expected_valid": true,
      "actual_valid": true,
      "expected_error_codes": [],
      "actual_error_codes": [],
      "passed": true,
      "purpose": "Positive ASIEP evidence example.",
      "related_invariant_ids": [
        "I1",
        "I2",
        "I3",
        "I4",
        "I5",
        "I6",
        "I8",
        "I10"
      ],
      "related_metric_ids": [
        "evidence_completeness",
        "false_positive_rate",
        "gate_reproducibility"
      ]
    },
    {
      "target_path": "examples/invalid_missing_gate_report.json",
      "target_type": "evidence_example",
      "command": "PYTHONPATH=src python -m asiep_validator examples/invalid_missing_gate_report.json --format json",
      "expected_valid": false,
      "actual_valid": false,
      "expected_error_codes": [
        "SCHEMA"
      ],
      "actual_error_codes": [
        "SCHEMA"
      ],
      "passed": true,
      "purpose": "Attack sample for missing gate report evidence.",
      "related_invariant_ids": [
        "I5"
      ],
      "related_metric_ids": [
        "tamper_detection_recall"
      ]
    },
    {
      "target_path": "examples/invalid_promote_with_regression.json",
      "target_type": "evidence_example",
      "command": "PYTHONPATH=src python -m asiep_validator examples/invalid_promote_with_regression.json --format json",
      "expected_valid": false,
      "actual_valid": false,
      "expected_error_codes": [
        "INV_SAFETY_REGRESSION"
      ],
      "actual_error_codes": [
        "INV_SAFETY_REGRESSION"
      ],
      "passed": true,
      "purpose": "Attack sample for unsafe promote decision with safety regression.",
      "related_invariant_ids": [
        "I6"
      ],
      "related_metric_ids": [
        "tamper_detection_recall",
        "gate_reproducibility"
      ]
    },
    {
      "target_path": "examples/invalid_hash_chain_break.json",
      "target_type": "evidence_example",
      "command": "PYTHONPATH=src python -m asiep_validator examples/invalid_hash_chain_break.json --format json",
      "expected_valid": false,
      "actual_valid": false,
      "expected_error_codes": [
        "REF_UNRESOLVED"
      ],
      "actual_error_codes": [
        "REF_UNRESOLVED"
      ],
      "passed": true,
      "purpose": "Attack sample for broken evidence reference closure.",
      "related_invariant_ids": [
        "I4"
      ],
      "related_metric_ids": [
        "tamper_detection_recall"
      ]
    },
    {
      "target_path": "examples/invalid_promote_with_p2f_threshold_violation.json",
      "target_type": "evidence_example",
      "command": "PYTHONPATH=src python -m asiep_validator examples/invalid_promote_with_p2f_threshold_violation.json --format json",
      "expected_valid": false,
      "actual_valid": false,
      "expected_error_codes": [
        "INV_FLIP_THRESHOLD"
      ],
      "actual_error_codes": [
        "INV_FLIP_THRESHOLD"
      ],
      "passed": true,
      "purpose": "Attack sample for threshold-violating promote decision.",
      "related_invariant_ids": [
        "I8"
      ],
      "related_metric_ids": [
        "tamper_detection_recall",
        "gate_reproducibility"
      ]
    },
    {
      "target_path": "examples/invalid_transition_order.json",
      "target_type": "evidence_example",
      "command": "PYTHONPATH=src python -m asiep_validator examples/invalid_transition_order.json --format json",
      "expected_valid": false,
      "actual_valid": false,
      "expected_error_codes": [
        "STATE_TRANSITION"
      ],
      "actual_error_codes": [
        "STATE_TRANSITION"
      ],
      "passed": true,
      "purpose": "Attack sample for invalid state transition order.",
      "related_invariant_ids": [
        "I2",
        "I3"
      ],
      "related_metric_ids": [
        "tamper_detection_recall"
      ]
    },
    {
      "target_path": "examples/invalid_promote_with_regression.json",
      "target_type": "repair_case",
      "command": "PYTHONPATH=src python -m asiep_repairer examples/invalid_promote_with_regression.json --format json",
      "expected_valid": true,
      "actual_valid": true,
      "expected_error_codes": [],
      "actual_error_codes": [],
      "passed": true,
      "purpose": "Repair plan case for unsafe promote decision.",
      "related_invariant_ids": [
        "I6"
      ],
      "related_metric_ids": [
        "agent_readability"
      ]
    },
    {
      "target_path": "examples/invalid_promote_with_p2f_threshold_violation.json",
      "target_type": "repair_case",
      "command": "PYTHONPATH=src python -m asiep_repairer examples/invalid_promote_with_p2f_threshold_violation.json --format json",
      "expected_valid": true,
      "actual_valid": true,
      "expected_error_codes": [],
      "actual_error_codes": [],
      "passed": true,
      "purpose": "Repair plan case for flip-count threshold violation.",
      "related_invariant_ids": [
        "I8"
      ],
      "related_metric_ids": [
        "agent_readability"
      ]
    },
    {
      "target_path": "examples/bundles/valid_chatbot_bundle/bundle.json",
      "target_type": "bundle",
      "command": "PYTHONPATH=src python -m asiep_resolver examples/bundles/valid_chatbot_bundle/bundle.json --format json",
      "expected_valid": true,
      "actual_valid": true,
      "expected_error_codes": [],
      "actual_error_codes": [],
      "passed": true,
      "purpose": "Positive local evidence bundle.",
      "related_invariant_ids": [
        "I4",
        "I10"
      ],
      "related_metric_ids": [
        "evidence_completeness",
        "false_positive_rate"
      ]
    },
    {
      "target_path": "examples/bundles/invalid_missing_artifact_bundle/bundle.json",
      "target_type": "bundle",
      "command": "PYTHONPATH=src python -m asiep_resolver examples/bundles/invalid_missing_artifact_bundle/bundle.json --format json",
      "expected_valid": false,
      "actual_valid": false,
      "expected_error_codes": [
        "BUNDLE_ARTIFACT_MISSING"
      ],
      "actual_error_codes": [
        "BUNDLE_ARTIFACT_MISSING"
      ],
      "passed": true,
      "purpose": "Attack sample for missing local artifact.",
      "related_invariant_ids": [
        "I4"
      ],
      "related_metric_ids": [
        "tamper_detection_recall"
      ]
    },
    {
      "target_path": "examples/bundles/invalid_digest_mismatch_bundle/bundle.json",
      "target_type": "bundle",
      "command": "PYTHONPATH=src python -m asiep_resolver examples/bundles/invalid_digest_mismatch_bundle/bundle.json --format json",
      "expected_valid": false,
      "actual_valid": false,
      "expected_error_codes": [
        "BUNDLE_DIGEST_MISMATCH"
      ],
      "actual_error_codes": [
        "BUNDLE_DIGEST_MISMATCH"
      ],
      "passed": true,
      "purpose": "Attack sample for artifact digest tampering.",
      "related_invariant_ids": [
        "I10"
      ],
      "related_metric_ids": [
        "tamper_detection_recall"
      ]
    },
    {
      "target_path": "examples/bundles/invalid_path_escape_bundle/bundle.json",
      "target_type": "bundle",
      "command": "PYTHONPATH=src python -m asiep_resolver examples/bundles/invalid_path_escape_bundle/bundle.json --format json",
      "expected_valid": false,
      "actual_valid": false,
      "expected_error_codes": [
        "BUNDLE_PATH_ESCAPE"
      ],
      "actual_error_codes": [
        "BUNDLE_PATH_ESCAPE"
      ],
      "passed": true,
      "purpose": "Attack sample for unsafe path escape.",
      "related_invariant_ids": [
        "I4"
      ],
      "related_metric_ids": [
        "tamper_detection_recall"